{
  "task": "Compare skill-only versus skill-plus-local-tool for the first cloud handoff. Which one can reduce initial external context exposure and why?",
  "hard_constraints": [
    "Do not claim the skill alone can hide context already sent to cloud."
  ],
  "evidence": [
    {
      "id": "CON-D1-09-1",
      "path": "@constraint/1",
      "content": "Do not claim the skill alone can hide context already sent to cloud.",
      "reason": [
        "lossless"
      ]
    },
    {
      "id": "REQ-D1-09",
      "path": "@request",
      "content": "Compare skill-only versus skill-plus-local-tool for the first cloud handoff. Which one can reduce initial external context exposure and why?",
      "reason": [
        "lossless"
      ]
    },
    {
      "id": "FILE:README.md",
      "path": "README.md",
      "content": "# local2api\n\n`local2api` is a lightweight OpenAI-compatible inference gateway for a developer workstation. It routes suitable requests to a local LLM and can route heavier requests to an optional external backend, while keeping routing observable and avoiding unsafe silent degradation.\n\n> Status: **v0.0.1 foundation**. Web-account/session adapters are intentionally not bundled into the core. Use only integrations that comply with the upstream provider's terms and your account permissions.\n\n## Quick start\n\n```bash\npython -m venv .venv\n# Windows: .venv\\Scripts\\activate\n# Linux/macOS: source .venv/bin/activate\npip install -e \".[test]\"\npython -m local2api.main\n```\n\nDefault endpoint: `http://127.0.0.1:8000/v1/chat/completions`.\n\nSee `docs/index.md`, `plan.md`, and `docs/test_plan.md`.\n",
      "reason": [
        "lexical_seed"
      ]
    },
    {
      "id": "FILE:docs/index.md",
      "path": "docs/index.md",
      "content": "# local2api — Project Documentation\n\n## 1. Purpose\n\n`local2api` is an OpenAI-compatible local gateway for a 32 GB developer laptop. The primary goal is not to make every prompt local; it is to select the cheapest/most private backend that is capable of the task, while preserving a stable API for VS Code, Continue-like clients, Open WebUI, and custom tools.\n\nThe target workstation for the first real-device benchmark is:\n\n- Intel Core Ultra 7 258V\n- Intel Arc 140V integrated GPU / unified memory\n- 32 GB LPDDR5X RAM\n- Windows 11\n\nPublic `llama.cpp` results on the same CPU/iGPU show that 7B-class Q4 models are practical, while larger models become progressively slower and can expose backend-specific GPU allocation/fused-kernel issues. Therefore v0.0.1 treats a 7B/8B Q4 local model as the default target rather than assuming a fixed 12–14 GB model allocation.\n\n## 2. Architecture\n\n```text\nVS Code / Open WebUI / Client\n            |\n            v\n+-----------------------------+\n| local2api OpenAI Gateway    |\n| /v1/chat/completions        |\n| /v1/models                  |\n| /health                     |\n+-------------+---------------+\n              |\n        RoutingDecision\n       /               \\\n      v                 v\nLocal LLM adapter     External API adapter\n(llama.cpp etc.)      (official API or user-supplied compatible service)\n```\n\n### Design rule\n\n**Task capability, not prompt length alone, decides routing.** Length remains one signal only.\n\nv0.0.1 uses a deterministic rules router so every decision can be inspected and tested. Later versions may add context-aware scoring.\n\n## 3. Backend policy\n\n### Local backend\n\nRecommended first target: a coding-capable 7B/8B GGUF Q4 model via `llama.cpp` or another OpenAI-compatible local runtime. Exact model/runtime must be benchmarked on the target Windows laptop before being promoted to the default configuration.\n\n### External backend\n\nCore local2api accepts an OpenAI-compatible HTTP endpoint. This can be an official cloud API or another service the user is authorized to operate.\n\nWeb-account-to-API wrappers based on browser cookies/session tokens are **experimental integrations**, not a reliability or zero-cost guarantee. They can break when upstream services change and may conflict with provider terms if they automate extraction, bypass safeguards, or circumvent usage limits. local2api v0.0.1 does not implement CAPTCHA bypass, rate-limit circumvention, or automated credential extraction.\n\n## 4. Routing and fallback\n\nThe client can select:\n\n- `model=local2api-auto` — router decides.\n- `model=local` — force local backend.\n- `model=cloud` — force external backend.\n\nResponse headers expose the decision:\n\n```text\nX-Local2API-Backend: local|cloud\nX-Local2API-Route-Reason: <reason>\n```\n\nFallback is capability-aware. A cloud outage does **not** automatically send architecture/repository reasoning to a weaker local model. Safe, degradable work may fall back; high-complexity work returns a clear `503 backend_unavailable` instead of silently returning lower-quality output.\n\n## 5. Streaming\n\n`stream=true` is supported as SSE pass-through in v0.0.1. Once stream bytes have started, switching backends is unsafe because it could mix two generations. Streaming fallback therefore remains conservative.\n\n## 6. Privacy\n\nLocal requests remain on the configured local inference endpoint. Requests routed to any external backend leave the laptop and inherit that provider's privacy/data-use policy. The router cannot make an external request private merely because it passes through localhost.\n\n## 7. Operational limitations in v0.0.1\n\n- No persistent conversation/context brain yet.\n- No circuit breaker or adaptive health scoring.\n- No semantic/result cache.\n- No automatic browser-cookie harvesting or CAPTCHA handling.\n- No claim that the system uses only 12–14 GB RAM; memory depends on the selected model, context, KV cache, runtime and OS.\n\n## 8. Run\n\n```bash\npip install -e \".[test]\"\npython -m local2api.main\n```\n\nEnvironment options are shown in `.env.example`.\n",
      "reason": [
        "lexical_seed"
      ]
    },
    {
      "id": "FILE:docs/research/architecture_challenge_and_router_landscape.md",
      "path": "docs/research/architecture_challenge_and_router_landscape.md",